{
  "schema_version": "1.1",
  "event_id": "EVT-20260720-ESC-001",
  "task_id": "TASK-20260720-REFUND-BUSAN-019",
  "parent_event_id": "EVT-20260720-REFUND-003",
  "timestamp": "2026-07-20T14:32:00+09:00",
  "channel": "cowork",
  "agent": "cowork_luna",
  "event_type": "human_approval_requested",
  "status": "escalated",
  "session_id": "SESS-COWORK-20260720-4471",
  "user_ref": "user_hash_b77e2d",
  "intent": "refund_request",
  "raw_input": "블루베리 박스 절반이 썩어서 왔어요. 전액 환불해주세요. 사진 있습니다.",
  "input_summary": "공동구매 상품 품질 불량 (절반 부패) 전액 환불 요청 — 증거 사진 첨부됨. 금액 50,000원 초과로 CEO 승인 필요.",
  "output_summary": "전액 환불 요청 접수 완료. 담당자 승인 요청 발송. 처리 예상 시간 2시간 이내.",
  "tool": "escalation_router",
  "next_agent": "human",
  "failure_category": null,
  "failure_code": null,
  "human_approval_required": true,
  "workflow_id": "WF-20260720-REFUND-019",
  "step_no": 2,
  "step_name": "CEO승인요청",
  "delegated_from": "cowork_luna",
  "delegated_to": "human",
  "confidence": 0.88,
  "response_time_ms": 540,
  "adapter_version": "cowork-agent-v1.0",
  "metadata": {
    "locale": "ko-KR",
    "source_message_type": "text",
    "client": "cowork-desktop",
    "attachments": 2,
    "message_length": 38,
    "language": "ko",
    "timezone": "Asia/Seoul",
    "model": "claude-sonnet-5",
    "retry_count": 0
  }
}
