[
  {
    "schema_version": "1.1",
    "event_id": "EVT-20260720-COOP-001",
    "task_id": "TASK-20260720-COOP-PAJU-001",
    "parent_event_id": null,
    "timestamp": "2026-07-20T09:00:00+09:00",
    "channel": "kakao",
    "agent": "kakao_luna",
    "event_type": "message_received",
    "status": "received",
    "session_id": "SESS-KAKAO-20260720-8821",
    "user_ref": "user_hash_a91f3c",
    "intent": "coop_request",
    "raw_input": "파주 블루베리 공동구매 신청하고 싶어요. 지금 몇 명이나 모였나요?",
    "input_summary": "카카오 채널 사용자 — 파주 블루베리 공동구매 참여 신청 및 현재 모집 인원 문의",
    "output_summary": null,
    "tool": null,
    "next_agent": "search_luna",
    "failure_category": null,
    "failure_code": null,
    "human_approval_required": false,
    "workflow_id": "WF-20260720-COOP-001",
    "step_no": 1,
    "step_name": "메시지수신",
    "delegated_from": null,
    "delegated_to": "search_luna",
    "confidence": null,
    "response_time_ms": 42,
    "adapter_version": "kakao-openbuilder-v2.3",
    "metadata": {
      "locale": "ko-KR",
      "source_message_type": "text",
      "client": "kakao-openbuilder",
      "message_length": 29,
      "language": "ko",
      "timezone": "Asia/Seoul"
    }
  },
  {
    "schema_version": "1.1",
    "event_id": "EVT-20260720-COOP-002",
    "task_id": "TASK-20260720-COOP-PAJU-001",
    "parent_event_id": "EVT-20260720-COOP-001",
    "timestamp": "2026-07-20T09:00:01+09:00",
    "channel": "internal",
    "agent": "search_luna",
    "event_type": "search_requested",
    "status": "processing",
    "session_id": "SESS-KAKAO-20260720-8821",
    "user_ref": "user_hash_a91f3c",
    "intent": "coop_request",
    "raw_input": null,
    "input_summary": "파주 블루베리 공동구매 상품정보 및 현재 모집 인원 조회 요청",
    "output_summary": null,
    "tool": "coop_db_search",
    "next_agent": null,
    "failure_category": null,
    "failure_code": null,
    "human_approval_required": false,
    "workflow_id": "WF-20260720-COOP-001",
    "step_no": 2,
    "step_name": "상품조회",
    "delegated_from": "kakao_luna",
    "delegated_to": null,
    "confidence": null,
    "response_time_ms": null,
    "adapter_version": "search-agent-v1.1",
    "metadata": {
      "locale": "ko-KR",
      "language": "ko",
      "timezone": "Asia/Seoul"
    }
  },
  {
    "schema_version": "1.1",
    "event_id": "EVT-20260720-COOP-003",
    "task_id": "TASK-20260720-COOP-PAJU-001",
    "parent_event_id": "EVT-20260720-COOP-002",
    "timestamp": "2026-07-20T09:00:01+09:00",
    "channel": "internal",
    "agent": "search_luna",
    "event_type": "search_completed",
    "status": "success",
    "session_id": "SESS-KAKAO-20260720-8821",
    "user_ref": "user_hash_a91f3c",
    "intent": "coop_request",
    "raw_input": null,
    "input_summary": "파주 블루베리 공동구매 상품정보 및 현재 모집 인원 조회 요청",
    "output_summary": "파주 블루베리 2kg 박스 — 정상가 35,000원 / 공동구매가 24,500원(30% 할인). 현재 47명 모집, 목표 50명까지 3명 남음. 판매자: 파주팜 농업협동조합.",
    "tool": "coop_db_search",
    "next_agent": "kakao_luna",
    "failure_category": null,
    "failure_code": null,
    "human_approval_required": false,
    "workflow_id": "WF-20260720-COOP-001",
    "step_no": 3,
    "step_name": "가격확인",
    "delegated_from": null,
    "delegated_to": "kakao_luna",
    "confidence": 0.97,
    "response_time_ms": 215,
    "adapter_version": "search-agent-v1.1",
    "metadata": {
      "locale": "ko-KR",
      "language": "ko",
      "model": "claude-sonnet-5",
      "timezone": "Asia/Seoul"
    }
  },
  {
    "schema_version": "1.1",
    "event_id": "EVT-20260720-COOP-004",
    "task_id": "TASK-20260720-COOP-PAJU-001",
    "parent_event_id": "EVT-20260720-COOP-003",
    "timestamp": "2026-07-20T09:00:02+09:00",
    "channel": "kakao",
    "agent": "kakao_luna",
    "event_type": "response_sent",
    "status": "completed",
    "session_id": "SESS-KAKAO-20260720-8821",
    "user_ref": "user_hash_a91f3c",
    "intent": "coop_request",
    "raw_input": null,
    "input_summary": "파주 블루베리 공동구매 참여 신청 및 현재 모집 인원 문의",
    "output_summary": "파주 블루베리 2kg 공동구매 안내 및 신청 링크 발송 완료. 현재 47명 / 목표 50명. 참여 가능.",
    "tool": null,
    "next_agent": null,
    "failure_category": null,
    "failure_code": null,
    "human_approval_required": false,
    "workflow_id": "WF-20260720-COOP-001",
    "step_no": 4,
    "step_name": "주문확정",
    "delegated_from": "search_luna",
    "delegated_to": null,
    "confidence": 0.99,
    "response_time_ms": 88,
    "adapter_version": "kakao-openbuilder-v2.3",
    "metadata": {
      "locale": "ko-KR",
      "source_message_type": "text",
      "client": "kakao-openbuilder",
      "language": "ko",
      "timezone": "Asia/Seoul"
    }
  }
]
